username;date;retweets;favorites;text;geo;mentions;hashtags;id;permalink
RJ_Balaji;2015-12-04 10:39;870;568;"Imp. Guys we've managed to get one oxygen cylinder in big fm office today.In case of any emergency need,anybody can take tat from thre 24/7.";Mylapore Tiruvallike- India;;;"672847792709111808";https://twitter.com/RJ_Balaji/status/672847792709111808
RJ_Balaji;2015-12-04 09:49;1741;2134;"The news tat I gave one crore for releif fund is not true.Am not tat rich bt am rich enough to have all of u.All I have to give is myself.";Mylapore Tiruvallike- India;;;"672835119170760704";https://twitter.com/RJ_Balaji/status/672835119170760704
RJ_Balaji;2015-12-04 08:30;196;209;"@ dhanushkraja beleive d team has collected today. Need is more. If u av more tomorrow , we will come n collect it again.";Mylapore Tiruvallike- India;@;;"672815177029447680";https://twitter.com/RJ_Balaji/status/672815177029447680
RJ_Balaji;2015-12-04 08:00;574;392;"And finally,Whoever wants to take relief material n distribute to any of ur areas, plz come wit a vehicle to Big FM anytime. lets do this.";Mylapore Tiruvallike- India;;;"672807580142460930";https://twitter.com/RJ_Balaji/status/672807580142460930
RJ_Balaji;2015-12-04 07:56;439;384;"Guys. Mostly no network for me or @ Actor_Siddharth. To reach us, plz tweet here. It will reach us. Now back to work. Stay safe.";Mylapore Tiruvallike- India;@;;"672806791625900032";https://twitter.com/RJ_Balaji/status/672806791625900032
RJ_Balaji;2015-12-04 07:54;568;548;"To all the traffic police who helped us to load and unload in hundreds of vehicles in d busiest road without causin a havoc. Salute.";Mylapore Tiruvallike- India;;;"672806070369128448";https://twitter.com/RJ_Balaji/status/672806070369128448
RJ_Balaji;2015-12-04 07:51;437;464;"We were able to help out almost twice d number of ppl tat we reached yesterday only cos of all u unknown heroes.Thank you. @ Actor_Siddharth";Mylapore Tiruvallike- India;@;;"672805519447339008";https://twitter.com/RJ_Balaji/status/672805519447339008
RJ_Balaji;2015-12-04 07:42;925;391;"Need of d hour is blankets, mat, mosquito coil, Candle Sanitary napkins Saibol cream Food items Water bottles Plz dont bring old clothes.";Mylapore Tiruvallike- India;;;"672803119361732608";https://twitter.com/RJ_Balaji/status/672803119361732608
RJ_Balaji;2015-12-04 07:38;549;362;"Important: Those who want to volunteer for tomorrow, We av enough.plz do ur best in ur near by locality or reach velachery fr relief work.";Mylapore Tiruvallike- India;;;"672802192437325825";https://twitter.com/RJ_Balaji/status/672802192437325825
RJ_Balaji;2015-12-04 06:55;767;866;"Never expected this kind of support and trust across the globe.Truely humbled and inspired.Thank you everyone. Lets do this again tomorrow.";Chennai- India;;;"672791445728718848";https://twitter.com/RJ_Balaji/status/672791445728718848
RJ_Balaji;2015-12-04 06:53;189;148;"Everyone Plz go back. Bedsheets will b wasted in rain. Give it tomorrow.https://twitter.com/imrameezraja/status/672789271686873088 …";None;;;"672790758450028544";https://twitter.com/RJ_Balaji/status/672790758450028544
RJ_Balaji;2015-12-04 06:36;783;909;"No words to describe the dedication of hundreds of volunteers who did d job today inspite of heavy rains. Thank you. U inspire us.";Chennai- India;;;"672786500090593282";https://twitter.com/RJ_Balaji/status/672786500090593282
RJ_Balaji;2015-12-04 05:58;505;221;"IMP- People bringing stock to BIG FM it is full as of now. Pass on all the materials to the camp at Guru Nanak college. Our team is there";Chennai- India;;;"672776879275835392";https://twitter.com/RJ_Balaji/status/672776879275835392
RJ_Balaji;2015-12-04 05:54;167;77;"Someone help.https://twitter.com/yaathu0424/status/672640697909006336 …";None;;;"672775910500646912";https://twitter.com/RJ_Balaji/status/672775910500646912
RJ_Balaji;2015-12-03 23:55;391;200;"Any one at jaffarkanpet with a working phone and can check on ppl? Please pass your number to @ madhiceg";None;@;;"672685696805568512";https://twitter.com/RJ_Balaji/status/672685696805568512
RJ_Balaji;2015-12-03 21:36;573;273;"Volunteers req to delvr ID batter in W Mmblm & Ashk ngr. Sign up Tweet name ph#& loc to @ madhiceg @VivekBharati_VBpic.twitter.com/7zbbnBBuKl";None;@ @VivekBharati_VBpic;;"672650733141946368";https://twitter.com/RJ_Balaji/status/672650733141946368
RJ_Balaji;2015-12-03 20:56;522;460;"We r getting 5 tractors today to rescue ppl from flooded places. Dont how many we can reach, hoping to save more.";Mylapore Tiruvallike- India;;;"672640709116239872";https://twitter.com/RJ_Balaji/status/672640709116239872
RJ_Balaji;2015-12-03 20:46;482;224;"Mats, blankets and water are d one in big need. Bring t to Big FM, 152/153,azam arcade, dominos building, kodambakkam high rd, nungambakkam.";Mylapore Tiruvallike- India;;;"672638169154736128";https://twitter.com/RJ_Balaji/status/672638169154736128
RJ_Balaji;2015-12-03 20:42;472;252;"Anyone wants to contribute or take things for distribution to needy.. We r here in Big FM. Plz come. Ppl with big vehicles come fwd.";Mylapore Tiruvallike- India;;;"672637169807327232";https://twitter.com/RJ_Balaji/status/672637169807327232
RJ_Balaji;2015-12-03 12:38;372;186;"PPl in USA plz note.https://twitter.com/princeofayodhya/status/672511595193368576 …";Mylapore Tiruvallike- India;;;"672515312198225920";https://twitter.com/RJ_Balaji/status/672515312198225920
RJ_Balaji;2015-12-03 12:35;23;69;"@ Udhaystalin thank u somuch.!";Mylapore Tiruvallike- India;@;;"672514577574330368";https://twitter.com/RJ_Balaji/status/672514577574330368
RJ_Balaji;2015-12-03 12:33;25;48;"@ Udhaystalin ur no. Not reachable uday. We need d same tomorrow too. Befre 11am if possible plz.";None;@;;"672513925569728512";https://twitter.com/RJ_Balaji/status/672513925569728512
RJ_Balaji;2015-12-03 12:18;252;207;"Ppl can not only give ur contributions in Big fm office, but also collect whatever u need to distribute by urself. 24/7.";Mylapore Tiruvallike- India;;;"672510180043698176";https://twitter.com/RJ_Balaji/status/672510180043698176
RJ_Balaji;2015-12-03 12:12;357;421;"Hats off to hundreds of volunteers who came today to big fm.The work that u ppl did is amazing. Lets do this again tomorrow.";Mylapore Tiruvallike- India;;;"672508829179973633";https://twitter.com/RJ_Balaji/status/672508829179973633
RJ_Balaji;2015-12-03 11:51;267;340;"Ive left big fm, you can hand over all your contributions 24/7 there. We av ppl thre. Family is safe. We r relocating. Thank u.";Mylapore Tiruvallike- India;;;"672503433707053056";https://twitter.com/RJ_Balaji/status/672503433707053056
RJ_Balaji;2015-12-03 11:07;979;399;"My family is stranded in kottur. Wit no phone, current and water. Someone plz let me know d status of perumal koil street.";Mylapore Tiruvallike- India;;;"672492354906030081";https://twitter.com/RJ_Balaji/status/672492354906030081
RJ_Balaji;2015-12-03 11:04;231;116;"I still av stocks to collect n store. Cant go now. Someone plz help me in finding bout kotturpuram situation.";None;;;"672491628595122177";https://twitter.com/RJ_Balaji/status/672491628595122177
RJ_Balaji;2015-12-03 09:37;357;252;"Guys in foreign, someone plz confirm if the transfer to # ChennaiMicroFund trust is successful ? Are u facing any issues. Plz let us know.";Egmore Nungambakkam- India;;;"672469837520728064";https://twitter.com/RJ_Balaji/status/672469837520728064
RJ_Balaji;2015-12-03 09:21;529;164;"# ChennaiRescue anyone from TCS siruseri? Pls tweet back. A girl there...appa passed away in Hyde. Trying to reach her. @ subhajrao";Egmore Nungambakkam- India;@;;"672465651311779840";https://twitter.com/RJ_Balaji/status/672465651311779840
RJ_Balaji;2015-12-03 08:21;1477;792;"And to those who wants to contribute as money, this is d offical trust account. # ChennaiMicroFundpic.twitter.com/jrAChyccu4";Egmore Nungambakkam- India;;;"672450520414597120";https://twitter.com/RJ_Balaji/status/672450520414597120
RJ_Balaji;2015-12-03 08:15;722;496;"Plz bring ur contributions mainly blankets,mats,candle,mosquito coil and food. We av volunteers 24/7 in big fm to collect.";Egmore Nungambakkam- India;;;"672449057474891776";https://twitter.com/RJ_Balaji/status/672449057474891776
RJ_Balaji;2015-12-03 08:12;902;856;"We Managed to deliver food,blankets and mat for more than 20000 ppl today.Thanx to each one who came to big fm. tomorrow we r doin it again.";Egmore Nungambakkam- India;;;"672448413963788288";https://twitter.com/RJ_Balaji/status/672448413963788288
RJ_Balaji;2015-12-03 06:46;1251;585;"# ChennaiMicroFund contribution A/c Name: V Trust, A/C NO: 533102010503421, UNION BANK OF INDIA, IFSC CODE: UBIN0553310. # SiddharthRJbalaji";None;;;"672426712307646464";https://twitter.com/RJ_Balaji/status/672426712307646464
RJ_Balaji;2015-12-03 02:33;507;247;"We av huge some of food packets in big fm.Distributing across city. Plz tell us where are d needs. Pz note Car shld b ble to reach thre.";None;;;"672363006123098112";https://twitter.com/RJ_Balaji/status/672363006123098112
RJ_Balaji;2015-12-03 02:04;474;308;"People across the world. If u want to contribute fund fr Chennai flood rescue measures by me, @ Actor_Siddharth,we'l tweet an Trust acc soon.";None;@;;"672355698034892800";https://twitter.com/RJ_Balaji/status/672355698034892800
RJ_Balaji;2015-12-03 01:47;175;160;"Please be advised this is a friend of @ RJ_Balaji tweeting on his behalf from Bangalore. Strength to you chennai. # ChennaiRainsHelp";None;@;;"672351505870032896";https://twitter.com/RJ_Balaji/status/672351505870032896
RJ_Balaji;2015-12-03 01:39;468;179;"BIG FM Address: 152 Azam arcade kodambakkam high road , Nugambakkam chennai - 34. LM: Opp indiabulls. Doors open to any contribution.";None;;;"672349547373309952";https://twitter.com/RJ_Balaji/status/672349547373309952
RJ_Balaji;2015-12-03 01:29;479;217;"I am at big FM office. Stock piling essentials for distribution. Bring your contributions here. Blanket,mat,water and food are top priority.";None;;;"672346878999068672";https://twitter.com/RJ_Balaji/status/672346878999068672
RJ_Balaji;2015-12-03 01:21;298;194;"Nothing S workin plz don't wait for net to do somethin. As a group go out n do wats possible. You can always find me in big fm releif center";None;;;"672344939527671808";https://twitter.com/RJ_Balaji/status/672344939527671808
RJ_Balaji;2015-12-02 11:30;174;224;"@ ash_r_dhanush jus reached wunderbar office. All d biscuit packets have been taken alrdy. Let me know once u get d stock again.Will collect.";Egmore Nungambakkam- India;@;;"672135832183119872";https://twitter.com/RJ_Balaji/status/672135832183119872
RJ_Balaji;2015-12-02 11:09;554;289;"Those wit a group to volunteer. Preferably wit a car. Tweet ur ph no. Wit name and area. We need u. # ChennaiMicro @ Actor_Siddharth";Egmore Nungambakkam- India;@;;"672130567811543040";https://twitter.com/RJ_Balaji/status/672130567811543040
RJ_Balaji;2015-12-02 11:06;605;241;"Woman pregnant wit twins. Ramapuram. Plz plz help.pic.twitter.com/cPesoRszAN";Egmore Nungambakkam- India;;;"672129687406190600";https://twitter.com/RJ_Balaji/status/672129687406190600
RJ_Balaji;2015-12-02 10:35;192;107;"We tried reaching them wit food. But d situation thre is very bad tht even NRDF cldnt reach them as d tide s highhttps://twitter.com/plss423/status/672120194567766016 …";Egmore Nungambakkam- India;;;"672122005404188677";https://twitter.com/RJ_Balaji/status/672122005404188677
RJ_Balaji;2015-12-02 10:18;811;486;"Guys. We r wit few vehicles to go around d city wit food packets. Teynampet to Airport. Let us know if someone needs food.";Chennai- India;;;"672117740925243392";https://twitter.com/RJ_Balaji/status/672117740925243392
RJ_Balaji;2015-12-02 07:29;529;208;"Guys we tweeted details bout d ppl offering oxygen cylinders. Kindly share it now. Someone needs it now. urgent.";Mylapore Tiruvallike- India;;;"672075079761678336";https://twitter.com/RJ_Balaji/status/672075079761678336
RJ_Balaji;2015-12-02 07:25;995;362;"Imp-Any college students as group of minimum ten,can u come fwd to volunteer fr tomorrow.We need ten groups min. Plz Form and tweet details.";Mylapore Tiruvallike- India;;;"672074173854912514";https://twitter.com/RJ_Balaji/status/672074173854912514
RJ_Balaji;2015-12-02 07:18;704;467;"Guys. We managed to get food for around 5000 ppl today in various areas. We need to do d same tomorrow. Plz lets it again. # ChennaiMicro";Mylapore Tiruvallike- India;;;"672072450981654528";https://twitter.com/RJ_Balaji/status/672072450981654528
RJ_Balaji;2015-12-02 07:10;283;262;"Feels very bad for not able to attend many of ur msgs due to network crash. We are doing our best to reach out to ppl. @ Actor_Siddharth";None;@;;"672070346258952192";https://twitter.com/RJ_Balaji/status/672070346258952192
RJ_Balaji;2015-12-02 07:01;227;125;"To all those trying to reach us, 6 hoursa no network. Dont know how long this will last. Plz go out and do wat ever little possible.";Mylapore Tiruvallike- India;;;"672068005623422976";https://twitter.com/RJ_Balaji/status/672068005623422976
RJ_Balaji;2015-12-02 06:56;337;165;"Completely cut off. On d roads fr d entire day. Supplying food in adyar now. Let us know if any region around this needs food. # ChennaiMicro";Mylapore Tiruvallike- India;;;"672066833093148676";https://twitter.com/RJ_Balaji/status/672066833093148676
RJ_Balaji;2015-12-02 06:54;1314;860;"To all the north indian media, more than ur debate and discussions , show some compassion. organize and collect basic amenities and send us.";None;;;"672066330099638272";https://twitter.com/RJ_Balaji/status/672066330099638272
RJ_Balaji;2015-12-02 06:54;814;591;"Since morning every north indian media has been calling for interviews.Thanx.But no thanx. Plz don't cover this as an issue,its a disaster.";None;;;"672066330032537604";https://twitter.com/RJ_Balaji/status/672066330032537604
RJ_Balaji;2015-12-02 01:44;299;133;"Guindy. Plz help.https://twitter.com/am_kathir/status/671986985083408385 …";Chennai- India;;;"671988270473994240";https://twitter.com/RJ_Balaji/status/671988270473994240
RJ_Balaji;2015-12-02 01:41;156;55;"Verify and plz help. This place s reachable.https://twitter.com/rasaaa2/status/671985443471257600 …";Chennai- India;;;"671987589960740864";https://twitter.com/RJ_Balaji/status/671987589960740864
RJ_Balaji;2015-12-02 01:39;454;214;"Very imp information for ppl in OMR..!https://twitter.com/ashwin93_be/status/671985410101264384 …";Chennai- India;;;"671987055610585088";https://twitter.com/RJ_Balaji/status/671987055610585088
RJ_Balaji;2015-12-02 01:35;494;225;"We av 250 packets of food near parrys, plz Let us know d place whre ppl in need are. Can be delivered in an hour.";Chennai- India;;;"671985990706184192";https://twitter.com/RJ_Balaji/status/671985990706184192
RJ_Balaji;2015-12-02 01:32;164;65;"Great service. Pass it on. Chromepethttps://twitter.com/dhivyadharshini/status/671955721936723969 …";Chennai- India;;;"671985288340635648";https://twitter.com/RJ_Balaji/status/671985288340635648
RJ_Balaji;2015-12-02 01:25;50;227;"No network. No internet. Lets get on to d roads n do our best.";Chennai- India;;;"671983478829780992";https://twitter.com/RJ_Balaji/status/671983478829780992
RJ_Balaji;2015-12-02 01:21;365;109;"This is very important. Guys plz verify and pass on.https://twitter.com/ratheeshvijay07/status/671954536274116608 …";None;;;"671982431218495488";https://twitter.com/RJ_Balaji/status/671982431218495488
RJ_Balaji;2015-12-02 01:21;155;63;"Rescuing ppl frm omr and IT hubs is not possible by u n me. Cos Thousands of them.Instead arrange fr food packets.We will reach them n give.";None;;;"671982431197487105";https://twitter.com/RJ_Balaji/status/671982431197487105
RJ_Balaji;2015-12-02 01:21;186;66;"So far Food for more than 5000 ppl av bin arranged, collected and sent to d ppl in need. We need more. Plz let us know if u av.";None;;;"671982430971027456";https://twitter.com/RJ_Balaji/status/671982430971027456
RJ_Balaji;2015-12-02 01:21;265;57;"Imp. Need volunteers to collect 250 food packets frm parrys sangeeta. This is his contact number : 9840346934 mr subu.";None;;;"671982429930852352";https://twitter.com/RJ_Balaji/status/671982429930852352
RJ_Balaji;2015-12-02 01:21;82;29;"Verified? If yes, we will send them.https://twitter.com/rajkishorlive/status/671948745160790016 …";Egmore Nungambakkam- India;;;"671982429846941697";https://twitter.com/RJ_Balaji/status/671982429846941697
RJ_Balaji;2015-12-01 23:40;162;60;"Contact dr bala.nursing home. They shld help. Find no. In jus dial. Someone plz.https://twitter.com/sk_barathi/status/671950933899677696 …";Chennai- India;;;"671956987651883008";https://twitter.com/RJ_Balaji/status/671956987651883008
RJ_Balaji;2015-12-01 23:31;233;67;"For ppl who need boat in thse areas.https://twitter.com/ikfizi/status/671910036700979201 …";Chennai- India;;;"671954827224616960";https://twitter.com/RJ_Balaji/status/671954827224616960
RJ_Balaji;2015-12-01 23:07;545;191;"Ekkadudhangal defense colony completely in a disaster state. Someone plz inform police, army and authorities.";Chennai- India;;;"671948778820079616";https://twitter.com/RJ_Balaji/status/671948778820079616
RJ_Balaji;2015-12-01 22:57;190;69;"This man. Dr in keelkattalai ready to serve.https://twitter.com/ashwin93_be/status/671945824520167424 …";Chennai- India;;;"671946228586835968";https://twitter.com/RJ_Balaji/status/671946228586835968
RJ_Balaji;2015-12-01 22:51;622;255;"Crocodiles in d city and all other nonsense are just rumours. Plz Stop spreading thse in watsapp and here. Will add more choas.";Egmore Nungambakkam- India;;;"671944665508122624";https://twitter.com/RJ_Balaji/status/671944665508122624
RJ_Balaji;2015-12-01 22:38;74;25;"Someone plz tag ppl in saidapet. https://twitter.com/ganga_bharani/status/671934345653837824 …";Chennai- India;;;"671941465669431296";https://twitter.com/RJ_Balaji/status/671941465669431296
RJ_Balaji;2015-12-01 22:17;299;170;"Out on roads. Trying our best to arrange for food. Collect, coordinate and distribute. If u have food packets let us know. @ Actor_Siddharth";Mylapore Tiruvallike- India;@;;"671936135837278209";https://twitter.com/RJ_Balaji/status/671936135837278209
RJ_Balaji;2015-12-01 22:02;37;10;"@ Olacabs any help possible ? https://twitter.com/ramjith_ap/status/671932072953430016 …";Mylapore Tiruvallike- India;@;;"671932317867204609";https://twitter.com/RJ_Balaji/status/671932317867204609
RJ_Balaji;2015-12-01 21:46;145;42;"Saidapet. We had some doctors frm there la. Plz tag them somehow.https://twitter.com/vinukanna/status/671927804770934784 …";Mylapore Tiruvallike- India;;;"671928400219475968";https://twitter.com/RJ_Balaji/status/671928400219475968
RJ_Balaji;2015-12-01 21:27;111;45;"Tried reaching as many as we can. But cldnt. Someone plz.https://twitter.com/lakshmyramki/status/671923158664933376 …";None;;;"671923566200225797";https://twitter.com/RJ_Balaji/status/671923566200225797
RJ_Balaji;2015-12-01 21:21;233;75;"Volunteers needed for distributing food.https://twitter.com/cinemacalendar/status/671921644428877824 …";Mylapore Tiruvallike- India;;;"671922063536349184";https://twitter.com/RJ_Balaji/status/671922063536349184
RJ_Balaji;2015-12-01 21:15;56;28;"@ arulnithitamil arul see if u cld thse kids wit ur food packets. https://twitter.com/prasanna_tweets/status/671917948269760514 …";Mylapore Tiruvallike- India;@;;"671920683169918978";https://twitter.com/RJ_Balaji/status/671920683169918978
RJ_Balaji;2015-12-01 21:01;185;51;"Drop it in -Big FM, 152/153, azam arcade, (dominos building), kodambakkam high road, nungambakkam, chennai-600034.https://twitter.com/plk_raja/status/671916131104325632 …";None;;;"671917058192310272";https://twitter.com/RJ_Balaji/status/671917058192310272
RJ_Balaji;2015-12-01 20:53;282;126;"We are getting food packets fr d needy. Those who can contribute , plz arrange n tweet d dtails. We will pick up.";None;;;"671915142594990080";https://twitter.com/RJ_Balaji/status/671915142594990080
RJ_Balaji;2015-12-01 20:46;710;240;"Global hospital needs help. Worst conditions. Patients and old ppl involved. Only possible frm Govt and army. Some officer here plz pass on";None;;;"671913393364688896";https://twitter.com/RJ_Balaji/status/671913393364688896
RJ_Balaji;2015-12-01 20:45;16;8;"@ RjAjai plz help thro ur station.https://twitter.com/svarvindh/status/671910448204156928 …";None;@;;"671913120332308480";https://twitter.com/RJ_Balaji/status/671913120332308480
RJ_Balaji;2015-12-01 20:37;143;50;"Some one verify and pass on.https://twitter.com/jesubln/status/671910277164761088 …";None;;;"671910938757369856";https://twitter.com/RJ_Balaji/status/671910938757369856
RJ_Balaji;2015-12-01 20:29;158;37;"Some one plz help. Tnagar need bread packets. https://twitter.com/sriniraghav/status/671907217407418368 …";None;;;"671909101723496454";https://twitter.com/RJ_Balaji/status/671909101723496454
RJ_Balaji;2015-12-01 20:20;134;34;"# ChennaiMicrohttps://twitter.com/troll_vips/status/671906682432184321 …";Mylapore Tiruvallike- India;;;"671906877890949120";https://twitter.com/RJ_Balaji/status/671906877890949120
RJ_Balaji;2015-12-01 20:19;92;32;"We r trying to get u soon. Will come fr u.https://twitter.com/rlokesh26/status/671900447217684481 …";None;;;"671906566916857856";https://twitter.com/RJ_Balaji/status/671906566916857856
RJ_Balaji;2015-12-01 20:19;37;15;"Think its an old msg. Still if someone can plz verify n help.https://twitter.com/shajidstr/status/671900381245403137 …";None;;;"671906564614184960";https://twitter.com/RJ_Balaji/status/671906564614184960
RJ_Balaji;2015-12-01 19:54;132;43;"Periyar nagar. Jawhar nagar. Transport facility. https://twitter.com/aish_thiru/status/671897040599670784 …";None;;;"671900137539559424";https://twitter.com/RJ_Balaji/status/671900137539559424
RJ_Balaji;2015-12-01 19:43;239;92;"Chromepet. Family wit an infant. Plz help. https://twitter.com/vinukanna/status/671893800202010625 …";Mylapore Tiruvallike- India;;;"671897335509606400";https://twitter.com/RJ_Balaji/status/671897335509606400
RJ_Balaji;2015-12-01 19:40;93;34;"Am sure, ppl thre need food. Plz give it to nearest. Difficult to collect frm thre n distribute elsewhere.https://twitter.com/aarmadhan/status/671892234162147328 …";Mylapore Tiruvallike- India;;;"671896687602892800";https://twitter.com/RJ_Balaji/status/671896687602892800
RJ_Balaji;2015-12-01 19:37;170;62;"Can we form a group of 20 near global hospital.!?! Ppl near tat place coordinate amongst urself. This s possible. https://twitter.com/latasrinivasan/status/671887831288049664 …";Mylapore Tiruvallike- India;;;"671895962944585731";https://twitter.com/RJ_Balaji/status/671895962944585731
RJ_Balaji;2015-12-01 19:24;80;28;"Plz Verify and someone plz see if u cld reach them.https://twitter.com/hari24_rg/status/671878048333959169 …";Mylapore Tiruvallike- India;;;"671892561661788162";https://twitter.com/RJ_Balaji/status/671892561661788162
RJ_Balaji;2015-12-01 19:16;70;18;"Contact details !?!https://twitter.com/lnarayananj/status/671886637077422081 …";Mylapore Tiruvallike- India;;;"671890699277611008";https://twitter.com/RJ_Balaji/status/671890699277611008
RJ_Balaji;2015-12-01 19:10;58;42;"Am leaving home in sometime. Will try reaching thre. https://twitter.com/priya_menon/status/671877755877744640 …";Mylapore Tiruvallike- India;;;"671889126631731201";https://twitter.com/RJ_Balaji/status/671889126631731201
RJ_Balaji;2015-12-01 19:06;52;25;"Go out and give to ppl in ur area who are in need. Plz Dont wait.https://twitter.com/aravindhnagul07/status/671887905221042176 …";Mylapore Tiruvallike- India;;;"671888236562636800";https://twitter.com/RJ_Balaji/status/671888236562636800
RJ_Balaji;2015-12-01 19:05;124;43;"This is verified. Someone who wants to help, order food for ppl frm this place. And we will pick up.https://twitter.com/onlykollywood/status/671887383017623553 …";Mylapore Tiruvallike- India;;;"671887969028935680";https://twitter.com/RJ_Balaji/status/671887969028935680
RJ_Balaji;2015-12-01 19:01;61;19;"Noted. MRTS STATIONS.https://twitter.com/askabuska/status/671880122232758272 …";Mylapore Tiruvallike- India;;;"671886932763238400";https://twitter.com/RJ_Balaji/status/671886932763238400
RJ_Balaji;2015-12-01 18:59;50;22;"Someone, plz suggest d links to him.https://twitter.com/uktamilbo/status/671885752825987072 …";Mylapore Tiruvallike- India;;;"671886276723793921";https://twitter.com/RJ_Balaji/status/671886276723793921
RJ_Balaji;2015-12-01 18:54;27;20;"Thank u. Plz start right away. Tweet d verified need/offerings. And rest of us will follow up.https://twitter.com/onlykollywood/status/671883796497588224 …";Mylapore Tiruvallike- India;;;"671884994424410112";https://twitter.com/RJ_Balaji/status/671884994424410112
RJ_Balaji;2015-12-01 18:52;65;19;"Plz verify if they can produce food for a large no. of ppl. https://twitter.com/kkgiree/status/671883319269711873 …";Mylapore Tiruvallike- India;;;"671884602194038784";https://twitter.com/RJ_Balaji/status/671884602194038784
RJ_Balaji;2015-12-01 18:49;454;227;"Celebrities - if you av any contact wit d owners of chain of hotels-sangita,thalapakatti.Plz ask them to prepare food packts.we'll collect.";Mylapore Tiruvallike- India;;;"671883961853870081";https://twitter.com/RJ_Balaji/status/671883961853870081
RJ_Balaji;2015-12-01 18:45;23;46;"@ ashwinravi99 Got tat. Will talk to d portals and also hotels. Thanx ashwin.";Mylapore Tiruvallike- India;@;;"671882781979373568";https://twitter.com/RJ_Balaji/status/671882781979373568
RJ_Balaji;2015-12-01 18:42;57;29;"Two sites to order.https://twitter.com/imvvignesh/status/671881362253570048 …";Mylapore Tiruvallike- India;;;"671882069635567616";https://twitter.com/RJ_Balaji/status/671882069635567616
RJ_Balaji;2015-12-01 18:41;152;72;"Someone tweet list of all d websites tat deliver the food items here. Its ok if d delivery s delayed. We will pick up.";Mylapore Tiruvallike- India;;;"671881753892524033";https://twitter.com/RJ_Balaji/status/671881753892524033
